CASE7;S1A;NARRADOR;Todos os membros da equipe estão nos seus lugares, o cirurgião principal completou com êxito a secção do estômago. É o momento de começar a anastomose jejunojenunal.  Neste momento, o cirurgião principal pede um agrafador intraluminal de 45 mm e o Instrumentalista e o enfermeiro responsável verificam que não sobrou nenhum. 
CASE7;D1A.1;Surgeon;Dá-me o agrafador intraluminal de 45 mm, por favor.
CASE7;D1A.2;Instrumentalist;Lamento, não há mais agrafadores.
CASE7;D1A.3;Circulating nurse;Vou à sala de material, verificar se temos outro.
CASE7;D1A.1.1;Main surgeon;Bem, temos de superar este imprevisto.
CASE7;D1A.1.1.1;Circulating nurse;Lamento, não há nenhum. Para arranjar um teríamos que telefonar ao hospital mais próximo.
CASE7;D1A.1.2;Main surgeon;O quê? Não sabes fazer o teu trabalho? 	
CASE7;D1A.1.3;Main surgeon;Vamos lá, agora tenho outro problema para resolver, como se não fosse suficiente cuidar do doente….
CASE7;D1A.1.4;Main surgeon;Isto é incrível! Não é possível trabalhar com esta equipe!	
CASE7;D1B;Instrumentalist;Não volte a falar-nos assim, pode ser o cirurgião, mas isso não lhe dá o direito de nos tratar assim.
CASE7;D1B.1;Main surgeon;Sim, certo, mas não é a primeira vez que acontece. Certifiquem-se nas próximas intervenções que todo o material está disponível antes de começar o procedimento.
CASE7;D1B.1.1;Instrumentalist;Tem razão, mas enganámo-nos no número da  referência.
CASE7;D1B.1.2;Circulating nurse;Lamento, não há nenhum. Para arranjar um teríamos que telefonar ao hospital mais próximo.
CASE7;D1B.2;Main surgeon;Tem razão, enervei-me, mas não é a primeira vez que acontece. Têm de ter a certeza que todo o material está disponível antes de começar o procedimento.
CASE7;D1B.2.1;Instrumentalist;A partir de agora confirmamos duas vezes.
CASE7;D1B.3;Main surgeon;Bem, essa é a tua opinião.
CASE7;D1B.4;main surgeon;Podes ter razão, mas esta é a minha sala de operações e isto não pode continuar!
CASE7;D1B.4.2;main surgeon;Telefona imediatamente e consegue os agrafadores o mias rápido possível!
CASE7;D2;Instrumentalist;O que fazemos agora? Continuamos ou pedimos os agrafadores ao outro hospital?
CASE7;D2.1;main surgeon;Vamos continuar, vou utilizar um fio de sutura  preto extra grosso. 	
CASE7;D2.2;main surgeon;Continuemos por laparoscopia,  vou continuar com sutura manual.
CASE7;D2.3;main surgeon;Continuemos, passamos a cirurgia aberta e continuamos com sutura manual.
CASE7;D2.4;main surgeon;Não podemos continuar! Telefona imediatamente e arranja os agrafadores o mais depressa possível!
CASE7;D3;Instrumentalist;Certo. Mas, telefonamos a pedir os agrafadores da mesma maneira?
CASE7;D3.1;main surgeon;Não ouviste? Continuamos!	
CASE7;D3.2;main surgeon;De facto. Por favor, faz a chamada e traz os agrafadores enquanto trabalhamos, para o caso de ser necessário.
CASE7;D3.3;main surgeon;Porque questiona as minhas decisões?
CASE7;D3.4;main surgeon;Porquê?
CASE7;D3.4.1;Instrumentalist;Penso que não temos nada a perder se os pedirmos, no caso de serem necessários mais à frente.
CASE7;D3.4.2;main surgeon;Sim, parece-me boa ideia. Por favor telefona.
CASE7;D4A;anaesthesiologist;Só posso dizer que o relógio está a andar e que não podemos esperar muito mais porque o doente pode estar em risco.
CASE7;D4A.1;main surgeon;Já decidi, e vamos cumprir. Por favor vigiem o doente. 	
CASE7;D4A.1.1;Circulating nurse;Isto é um trabalho de equipe e todos temos um papel aqui.
CASE7;D4A.2;main surgeon;Verdade, mas eu tomei uma decisão.
CASE7;D4A.3;main surgeon;Claro, farei todo o possível para acabar o mais rápido possível. 	
CASE7;D4A.4;main surgeon;Não te preocupes, sei fazer o meu trabalho e vamos acabar em breve. 	
CASE7;D4A.4.1;anaesthesiologist;Assim espero…
CASE7;D4B.1;main surgeon;Claro, farei todo o possível para acabar o mais rápido possível.
CASE7;D4B.2;main surgeon;Não te preocupes, sei fazer o meu trabalho e vamos acabar em breve. 
CASE7;D4B.3;main surgeon;Certo, vamos manter o foco.
CASE7;D4B.4;main surgeon;Tenho a certeza que sabes fazer o teu trabalho e manter o doente vivo.
CASE7;D5;anaesthesiologist;Não me parece apropriado. Não consigo ouvir os alarmes. 	
CASE7;D5.1;main surgeon;Porque não aumentas o som dos monitores?
CASE7;D5.2;main surgeon;Não te preocupes, baixamos o som do radio.
CASE7;D5.2.1;main surgeon;Por favor, põe mais baixo.
CASE7;D5.3;main surgeon;Podia aumentar o som para ouvir melhor.
CASE7;D5.3.1;Circulating nurse;Temos o agrafador!
CASE7;D5.4;main surgeon;Certo, não tinha reparado.
CASE7;D5.4.1;main surgeon;Por favor desliga-o.
CASE7;D6;Instrumentalist;Fantástico! Abro o agrafador?
CASE7;D6.1;main surgeon;Claro!
CASE7;D6.2;main surgeon;Sim, por favor.
CASE7;D6.3;main surgeon;Estou à espera.
CASE7;D6.4;main surgeon;O que achas?
CASE7;D7;main surgeon;Obrigado, o agrafador está posicionado corretamente.
CASE7;D7.1;main surgeon;Parabéns a todos, acabámos com sucesso um doente complicado.
CASE7;D7.2;main surgeon;Finalmente, espero que não se repita.
CASE7;D7.3;main surgeon;Bom trabalho, mas da próxima vez, temos de aprender com os erros.
CASE7;D7.4;main surgeon;Bem, esta é a última vez que trabalho com esta equipa.
CASE7;END1;NARRADOR;O procedimento foi concluído com sucesso.
CASE7;D8;anaesthesiologist;O doente está instável, temos de terminar em 10 minutos.
CASE7;D8.1;main surgeon;Ok
CASE7;D8.2;main surgeon;Eu sei, mas não consigo trabalhar mais depressa, há tanta pressão!
CASE7;D8.3;main surgeon;Os teus comentários ainda aumentam a pressão que já tenho.
CASE7;D8.4;main surgeon;É verdade, temos de acelerar, mas já não falta muito.	
CASE7;D9;Instrumentalist;Fantástico! Como resolvemos a complicação? Abro o agrafador?
CASE7;D9.1;main surgeon;Não o posso usar agora, já é tarde demais!
CASE7;D9.1.1;anaesthesiologist;Rápido! Precisamos de resolver isto!
CASE7;D9.2;main surgeon;Despachem-se, temos de controlar isto antes que o doente morra.
CASE7;D9.3;main surgeon;Não me incomodes, estou quase pronto. 
CASE7;D9.4;main surgeon;Sim, o mais rápido possível.
CASE7;END2;NARRADOR;O doente morre.
CASE7;D10;assistant surgeon;Tens a certeza? Nunca te vi a fazer um nó intracorpóreo.
CASE7;D10.1;main surgeon;Eu fiz um curso sobre isto recentemente. De qualquer forma, pede o agrafador, só porque pode fazer falta. .
CASE7;D10.2;main surgeon;Fiz um curso sobre isto recentemente
CASE7;D10.3;main surgeon;Estás a questionar as minhas competências?
CASE7;D10.4;main surgeon;Estás a brincar?
CASE7;D11A;main surgeon;Estamos a ter complicações, temos de reforçar a sutura manual.
CASE7;Q11A;assistant surgeon;Pensava que tinhas mais experiência que isto…
CASE7;D11A.1;main surgeon;Mete-te na tua vida e deixa-me trabalhar em paz.
CASE7;D11A.2;main surgeon;Este é um doente complicado e podem surgir complicações
CASE7;D11A.3;main surgeon;Isto é o melhor que consigo fazer com esta equipe.
CASE7;D11A.4;main surgeon;Temos que trabalhar como equipe para ultrapassar a situação.
CASE7;D12A;Instrumentalist;Está tudo bem, estamos a fazer uma fantástica equipa de trabalho.
CASE7;D12A.0;assistant surgeon;Bem, tudo isto é trabalho dos cirurgiões….
CASE7;D12A.1;main surgeon;O trabalho de equipe é importante, mas as competências técnicas são muito mais importantes.
CASE7;D12A.2;main surgeon;Isto é trabalho de equipe, apesar de nem toda a gente pensar o mesmo…
CASE7;D12A.3;main surgeon;Isto é definitivamente trabalho de equipe, um cirurgião sozinho não conseguiria fazê-lo.
CASE7;D12A.4;main surgeon;Claro! Tudo depende de mim, estou a fazer o trabalho todo.
CASE7;D13A;main surgeon;Já terminei, vamos confirmar a sutura com metileno azul.
CASE7;Q13A;assistant surgeon;Tens a certeza que a sutura de reforço é suficiente?
CASE7;D13A.1;main surgeon;Obrigada pela preocupação, mas penso que é suficiente porque fizemos um bom trabalho.
CASE7;D13A.1.1;Instrumentalist;Muito bem! Não há nenhuma fuga na sutura! Bom trabalho, terminámos.
CASE7;D13A.1.2;main surgeon;Vou suturar a pele e a seguir podes acordar o doente.
CASE7;D13A.2;main surgeon;Claro que tenho a certeza, estás a duvidar de mim?
CASE7;D13A.2.1;assistant surgeon;Não se trata de duvidar, mas eu faria outra sutura.
CASE7;D13A.3;main surgeon;Sei como fazer o meu trabalho.
CASE7;D13A.3.1;assistant surgeon;Bom, estou só a dizer que eu faria outra sutura…
CASE7;D13A.3.2;Instrumentalist;Oh, não! A sutura está a sangrar e o intestino rasgou!
CASE7;D13A.4;main surgeon;Não tenho a certeza, aparentemente está bem.
CASE7;D13B.4.1;Instrumentalist;Oh, não! A sutura está a sangrar porque o intestino rasgou! Devíamos ter pedido o agrafador assim que percebemos que faltava.
CASE7;D15.1;anaesthesiologist;Isto não está a correr bem, estamos a perder o doente.
CASE7;D15.2;main surgeon;Estou a tentar!
CASE7;D15.3;Instrumentalist;Devíamos ter pedido o agrafador.
CASE7;D15.4;assistant surgeon;Vês? Eu tinha razão. Não sei porque fizeste isto sem experiência suficiente. 
CASE7;D15.1.1;main surgeon;Cala-te e trabalha!
CASE7;D15.1.3;main surgeon;Rápido! Precisamos de resolver isto!
CASE7;D15.2.1;main surgeon;Se ao menos tivesse uma equipe melhor!
CASE7;D15.3.1;main surgeon;Isto é o recreio de uma escola?
CASE7;D15.4.1;main surgeon;Todos, por favor, concentrem-se no vosso trabalho!
CASE7;D8.1.1;Circulating nurse;Temos o agrafador!
CASE7;D9.3.1;main surgeon;Rápido! Precisamos de resolver isto!
CASE7;D11B;main surgeon;Estamos a ter complicações, temos de reforçar a sutura manual.
CASE7;D11B.1;main surgeon;Mete-te na tua vida e deixa-me trabalhar em paz.
CASE7;D11B.2;main surgeon;Este é um doente complicado e podem surgir complicações.
CASE7;D11B.3;main surgeon;Isto é o melhor que consigo fazer com esta equipe.
CASE7;D11B.4;main surgeon;Temos que trabalhar como equipe para ultrapassar a situação. 
